"id_com","id_membre","id_contenu","id_type","commentaire","abonner_fil","statut","pseudo_v1","date_post"
"20625","0","578","2","bonjour . moi c pareil , je sort avec depuis la rentrée et en fevrier il va peut etre dormir chez moi avec sa soeur tout et le gars c une tapette y ve pas me smacker sur la bouche il dit sur la joue ...... mais répondandt a ta question tu te laisse faire et le tour est jouer :-)","0","1",NULL,"2012-11-22 21:59:50"
"20626","0","829","2","tes cheveux sont trop long, tu devrais en couper une bonne longueur","0","1",NULL,"2012-11-23 11:02:05"
"20629","0","730","2","Salluuut!!! c'est clair que c'est rassurant de savoir que l'on est pas seul dnas cette situation, je suis avec mon cousin germain depuis un ans c'est le bonheur total je n'ai jamais connu un amour pareil je l'ai attendu, cherché mais JAMAIS je n'ai connu un truc pareil! jsui dingue de lui on s'aime à la folie seulement il ya le souci de al famille  :/ de son coté sava mais du mien personne ne le sait je me prépare à tout leur dire! ça passe ou ça casse mais quoi qu'il dise lui je m'en séparerai pas je l'aime trop <3 bon courage à toute et soyez heureuse!!! ","0","1",NULL,"2012-11-25 11:53:36"
"20630","0","578","2","Bjr,je vous dit que les bsx se fait avec le coeur gros bsx !!","0","1",NULL,"2012-11-25 19:33:08"
"20631","0","1552","2","Salut j'ai 13 ans et moi aussi j'ai un duvet et comme je suis chatin foncé sa se voie et j'ai souvent quelque moquerie sur ça,je suis très complexé et j'aimerai avoir un moyen pour le faire enlevé définitivement","1","1",NULL,"2012-11-25 19:57:42"
"20632","0","889","2","je suis en 6eme ma mere veut pas que j'ai des talon meme pas qui sont pas audu tout(3 ou 4cm)meme ma soeur qui a 13 ans(4eme) ne peut pas !!!sa me soullllle!!!!!","1","1",NULL,"2012-11-25 23:20:38"
"20634","0","867","2","j'aimerais me maquiller mais tres legerement et sans etre vulgaire !!mais ma mére ne veut pas comment faire ??","0","1",NULL,"2012-11-26 18:15:38"
"20636","0","3025","2","coucou","0","1",NULL,"2012-11-26 20:10:16"
"20640","0","889","2","Moi j'ai 14 ans, et sa fais 2-3 ans que je porte des talons, et il y a peu de temps j'ai flasher sur des bottines, je l'ai aient achetées, le seul problème c'est qu'elles font 9 cm (c'est un talon épais mais pa trop)et je l'ai aient portées 3 jours et depuis ce matin j'ai trop mal dans le bas du dos, dû coup, je vais m'abstenir de les mettres .. Tout sa pour dire qu'il ne faut pas y aller trop vite, et bien choisir :p","0","1",NULL,"2012-11-27 21:21:25"
"20641","0","730","2","Pareil, je sors avec mon cousin germain depuis 9 mois, c'est la première fois que j'aime quelqu'un comme ça mais vu qu'on se voit quasiment qu'aux réunions de famille et que personne est au courant, on doit être super discrets et, de son côté, il est prêt à l'annoncer mais pas moi, on sait pas comment le dire... Help us!!!  :(","0","1",NULL,"2012-11-27 23:48:04"
"20643","0","1191","2","Merci pour c'est explication mais je ne trouve pas se que je veut mais je pari que plus d'une adore le site aurevoir bonne chance pour le reste!!","0","1",NULL,"2012-11-28 15:51:22"
"20644","0","1191","2","Merci pour c'est explication mais je ne trouve pas se que je veut mais je pari que plus d'une adore le site aurevoir bonne chance pour le reste!!","0","1",NULL,"2012-11-28 15:52:24"
"20645","0","3433","2","je suis interese par la frange sur le cote me comment l entretenir et qu elle reste sur le cote tt les jr","0","1",NULL,"2012-11-28 17:25:04"
"20646","0","3434","2","j ai le meme probble j ai un visage rond avec un grand front et des joue jouflusj ai les cheveux noir et qu elle couleur vous me conseiller?J aimerai jsute eclaircir mes cheveux et que cela paraissent naturelle","0","1",NULL,"2012-11-28 17:33:10"
"20649","0","2150","2","J aime Betty aide moi à faire un hé te regarde tout les jours à la télé dans mère est fille :D","1","1",NULL,"2012-11-28 20:46:53"
"20648","0","3076","2","Je n'ai que 11 ans et je fait déjà des cauchemars ou je me fait  violer.J'ai peur,je pleure chaque fois que j'en parle.Les seules personne en qui j'en ai parlé sont mon cousin,mon père,l'Assistante sociale de mon collège et la Conseillère principale d'Education.","0","1",NULL,"2012-11-28 17:49:40"
"20651","3996","3468","2","Superbe sujet, touchant et qui arrive souvent à bien des filles. Merci ^_-","0","1",NULL,"2012-11-29 13:52:35"
"20652","1011","3426","2","Merci beaucoup pour tous ces conseils !Je vais me renseigner un peu plus sur les études de pharmacie même si j'hésite encore avec des études liées à la physique et aux maths :)Sinon, je pourrais peut-être tenter une école d'ingénieur chimiste avec une spécialisation dans le domaine de la cosmétique !En tout cas, merci pour votre aide ! :)","1","1",NULL,"2012-11-29 19:28:50"
"20655","0","889","2","moi j'ai 15 ans  et je porte des talons  de 5 cm ou 6 cm  sa me suffit largement  cest deja pas si mal je fais 1m 62 avec talons 1m 68 MOI JE SUIS heureuse largement","0","1",NULL,"2012-11-30 17:31:53"
"20656","0","889","2","moi j aore le caca ok","0","1",NULL,"2012-11-30 17:32:45"
"20666","0","2761","2","Salut tout le monde!! J'ai aussi un problème capillaire! Alors voilà il y a environ 1 an que je me fais tous les 5 mois mon lissage coréen, et maintenant je voudrais récupérer mes beaux cheveux bouclés, je sais vous devez vous demander pourquoi j'ai fais ça, mais j'étais mal à l'aise avec ses cheveux! ca demandé beaucoup d'entretien, mais maintenant je me sens prête à les assumer! :D , le souci est que maintenant j'ai les cheveux lisses à cause de mon lissage, je me demande si il y avait des techniques pour \"annuler\" mon lissage, ou est-ce que je dois attendre que mes cheveux poussent? :/ Merci d'avance :D","1","1",NULL,"2012-12-02 12:40:44"
"20670","0","853","2","j'ai un grand frond et je ne sais pas si je doit faire une meche balayé sur le coté ou une frange ! (j'ai les cheveus jusque en bas du dos) merci de me répondre !","1","1",NULL,"2012-12-02 15:41:39"
"20673","0","673","2","ne t'inquiete pas tu est une fille serieuse,bonne continuation dans ta vie,jusqu'au jour que tu trouvera une personne serieuse.","0","1",NULL,"2012-12-03 10:37:23"
"20676","0","889","2","Mais vous savez , même avec ou sans talons , c'est toujours pareil ;) ","0","1",NULL,"2012-12-03 20:15:12"
"20681","3409","3490","2","Merci beaucoup TDN!!! Pour la rapidité et pour vos idées ! Bisous !","0","1",NULL,"2012-12-04 18:59:46"
"20682","0","3424","2","Merci beaucoup de m'avoir répondu!Je leur en reparlerais! Pour ce qui est des moyens financiers, à vrai dire oui il y en a, et je pense que c'est justement cela mon problème. Je recherche une certaine autonomie et c'est ce qu'ils ne comprennent pas. Oui bien sur c'est tellement plus gratifiant d'obtenir quelque chose après s'être investi! Mais là un autre problème se pose, celui du transport! J'ai la malchance de vivre dans un petit village non desservi sauf pour le scolaire (ironie du sort: mon père est transporteur ... ^^\")! Donc pour un petit travail c'est plus problématique encore!Je vais donc réfléchir à tout cela! =D","1","1",NULL,"2012-12-04 22:08:51"
"20685","4068","2656","2","Coucou, Moi personnellement je te comprends, je sais que c'est difficile étant donner que tu l'aime et que tu sais qu'il t'aime aussi mais tu comprends pas pourquoi il agit ainsi.C'est dure mais il faut que tu te pose les bonne questions, c'est pas à toi de prendre une décision mais à lui, fait lui comprendre que c'est sois tout , soit rien et qu'apparament sont choix c'est rien, fait lui croire qu'il t'as perdu pour lui faire réaliser. Peut être que sa marchera ;)","0","1",NULL,"2012-12-05 15:52:17"
"20686","0","578","2","ouééé moi mon mec aime moi et une autre fille sa fait franchent mal au coeur","0","1",NULL,"2012-12-05 17:24:57"
"20687","0","2150","2","comment crée un blog de mode avec nos photos","0","1",NULL,"2012-12-05 18:59:17"
"20692","0","578","2","Hello;pliz j'ai vraiment besoin d'un conseil;cmme vous toutes.Je suis la fille la plus timide du monde,qui devvient rouge ecarlate quand on lui parle;ect.. Un garcon veut sortir avecmoi.Jai tres envie de dire oui,mais voilà ,ce qui me retiensc'est le baiser.Un smack;j'en ai deja fait c'est rien du toutmais \"encaper\";ca me fait tres tres peur...En lisant tout cescommentaires j'ai eteé assez rassurés mais...Oui je n'ai pas honte de le dire;j'ai bien compris,c'est moi(la fille) qui doit mettre ma langue dans sa bouche!?HONNETEMENT(entre filles) j'ai peur de rater sa bouche:$.Jai trés tres peur.Repionse serieuse attendue;merci enormement;kisskiss.","0","1",NULL,"2012-12-07 00:15:58"
"20695","0","3502","2","Seul moyen de mincir durablement : manger équilibré !Voici un bon exemple :http://www.jemangejemincis.com/exemple-menu/","0","1",NULL,"2012-12-07 22:07:27"
"20696","0","478","2","Moi j'adore porter des leggings d'ailleurs pour en trouver je vous conseil fortement d'aller sur http://lady-look.com c'est vraiment top comme site ! ","0","1",NULL,"2012-12-07 23:17:40"
"20697","0","847","2","moi je partirais de la question inverse....qu'est ce qui vous/nous gene au fait que nos tendres regarde des films porno..............","0","1",NULL,"2012-12-08 00:14:43"
"20701","0","578","2","bonjours,je suis amoureus d un garçon depuit 1 ans et trois moin je l aime a la folie mais lui me considaire juste pour sa copine est lundi j ai desider de l  embrasser je sais quil a une copin mais elle sera pas la comment je peux faire pour quil me repouse pas est que sa lui plais aider moi avant lundi svp ","1","1",NULL,"2012-12-08 17:51:36"
"20702","0","3329","2","Bonjour je prend actuellement la pillule diane 35 jvoudrai savoir ce elle fait pousser les poils sur le visage? ","0","1",NULL,"2012-12-09 00:02:54"
"20705","0","968","2","Bonsoir une petite question a vous poser je vient de me faire les nouveau ombré de l oréal et finalement au lieu d atteindre un blond je fini a l orange comme a chaque fois que j essaye du blond quelqu un serait il pourquoi merci","0","1",NULL,"2012-12-09 19:26:23"
"20716","0","3503","2","Le rasoir est le technique le plus simple et sans douleur après la crème épillante je crois!!!des bisous","0","1",NULL,"2012-12-12 08:11:36"
"20720","0","473","2","coucou j'aimerais savoir si c'est vrai que un masque au café donne aux cheveux une couleur plus foncé ?merci beaucoup pour vos réponses.","0","1",NULL,"2012-12-12 16:50:33"
"20722","0","772","2","salut, je mesure 1 m 55 cm, avant( il y à un an)je pesais toujours 46kg, et là depuis un an,c'est la cata!je suis montée à 50kg! Pour perdre du poids, je ne bois que un café le matin, un verre de jus de fruit durant la journée, je ne mange qu'au repas du soir, sainement avec c'est vrai deux à trois verres de vin sur la soirée, mais c'est tout! Et je coure 40 min, trois fois semaine! Je ne sais plus que faire!!! Ma silhouette n'est plus vraiment ce qu'elle était! Et le plus triste, c'est ma garde-robe, j'ai des vêtements magnifiques, que je ne sais même plus porter! Que faire???","1","1",NULL,"2012-12-12 18:20:33"
"20725","0","3188","2","Est ce que le nouveau produit l'oréal est bien pour faire le Tie and Dye?","0","1",NULL,"2012-12-13 08:46:34"
"20728","0","169","2","moi, tout s'est arrêté depuis que j'ai mis des slips en coton ?! ","0","1",NULL,"2012-12-13 19:13:03"
"20733","0","2150","2","Trop top votre blog","0","1",NULL,"2012-12-14 20:51:48"
"20736","0","1343","2","moi pareil je filpe en plus mon mec il est trop gentil je n'arrive pas me détendre pour l'embrasserenfin bref!!!!!!m","0","1",NULL,"2012-12-15 22:55:01"
"20737","0","554","2","vu comme elle te l'a présenté je pense qu'elles ont des relations intimes depuis longtemps et là ça relève de la psychiatrie car cette fille est et sera perturbée toute sa vie pour te proposer une chose pareille.carton plus que rouge pour la mère","0","1",NULL,"2012-12-15 23:55:35"
"20739","0","575","2","Bnjr jai arreter la pilule minidril il y a 1mois . Jai eu une rapport durant ma periode d ovulation. Ai je possibilité d etre enceinte mm si c 1fs?","0","1",NULL,"2012-12-16 12:40:28"
"20741","0","2169","2","je trouve qu'il devrait metre plus de photo :)","0","1",NULL,"2012-12-16 14:59:26"
"20742","0","2169","2","j'adore les bijoux gas il sont trop beau !!!!!!!!!!!! :);):);):);):);):);)","0","1",NULL,"2012-12-16 15:04:43"
"20743","0","2169","2","salut je m'appelle chloé et je voudrai un bracelet gas mais je ne sait pas le quel choisir il sont tous trop beau !!!!!!!!","0","1",NULL,"2012-12-16 15:07:33"
"20744","0","444","2","Coucou, désolée d'intervenir si tard dans la conversation mais moi j'ai moi aussi rencontré ce genre de situation cocasse x). J'ai eu mon permis au bout de 4 mois de conduite et le moniteur en question a pris contact avec moi peu de temps après. L'âge n'est pas un frein, j'ai 19 ans, lui 54 et nous sommes aujourd'hui ensemble depuis plus de 6 mois et somme très heureux ensemble. Bisous à tous!","1","1",NULL,"2012-12-16 16:12:59"
"20749","0","1799","2","Tu t'es marié depuis ? comment s'est passé ta nuit de noces?","0","1",NULL,"2012-12-17 01:52:30"
"20756","0","717","2","Slt moi c'est Oceane j'ai 16 ans je sort avec un homme de 23 ans entre nous c'est l'amour fou sa fait 3 ans qu'on est emsenbles j'avais 13 ans et lui 20 ans au début C'était bisard pour nous car il étai largement plus âgé que moi mais comme j'avais un phisique qui ne suivez avec pas mon âge.. Donc personne ne remarquer la différence.. À l'âge de 14 ans j'ai décider d'habiter chez lui.. Car je ne m'entendé plus avec ma mère.. Maintenant je continue mes étude et lui il a repris l'entreprise de son père.. ","0","1",NULL,"2012-12-19 00:11:41"
"20762","0","170","2","non il ne faut pas coupé trop court","0","1",NULL,"2012-12-20 07:51:39"
"20768","0","3544","2","J'ai presque eu même problème mais j'ai qu'une seule fois donc on ne peut pas dire que j'ai été boulimique. Nous venons de faire ça en SVT (je suis en 5e) et avons appris que les conséquences pouvaient être trèèès grave... (ex les dents pourrissent au bout d'un moment, c'est pas une blague) Perso moi ça m'a tout de suite découragée parce que je voulais vomir de temps à autre. J'ai me suis acceptée comme je suis (12 ans donc pour 1m63 et 55kg) et tout va pour le mieux! J'éspère que ça va vite aller mieux pour toi!","0","1",NULL,"2012-12-20 17:56:04"
"20769","0","578","2","Salut ecoutez c est cool de demander des conseils mais il faudrait aussi des reponses est ce que quelqun pourrait m expliqier vraiment tout tout en detail svp j ai trop la trouille","0","1",NULL,"2012-12-21 01:49:34"
"20776","0","608","2","le drap est interdit dans l'islam, on a pas à dévoiler ce qui s'est passé dans les rapports intimes avec notre mari. Aussi, ce qui m'a enmené sur ce site, c'est que moi aussi j'ai perdu ma virginité, mais moi c'été à l'âge de 4 ou 5 ans comme ca, j'été inconsciente et ignorante, aujourdhui je m rend compte vraiment de qu'est-ce que j'ai fait....ps: j'ai 13 ans et demie.Si nn, j'spère qu'on arrivera à surmonter les épreuves, courage mes soeurs!","0","1",NULL,"2012-12-23 14:18:43"
"20777","0","3135","2","voilas mon ventre gargoulle toujours du coté droit du colon en bat ca faits plusieur moi et il est gonflé et des foit il est plat j ai pris du probiotique mais ca ne me fait rien et je marche touts les jours 5 km je ne sais plus quoi faire merci de me répondre svp.ventura0009@hotmail.com","1","1",NULL,"2012-12-23 22:48:51"
"20778","0","1245","2","bonjour voila je devais avoir mes règle le 13 décembre et je les ai eu le 15 décembre et le premier jour de mes regles aux soir j ai eu la tete qui tourne et un vomissement je n ai pas reussit a manger quelque chose ce soir la et au lieu d avoir mes regles 7 je les ai eu 4 jour est ce possible que je suis enceinte?","1","1",NULL,"2012-12-24 12:30:58"
"20784","0","532","2","mdrrrrrrrrrrrrrrrrrrrrrrrrrrrrrrrrrrrrrrrrr","0","1",NULL,"2012-12-25 15:27:24"
"20785","0","3537","2","Je me permets un petit truc que m'avait enseigné mon grand père quand j'étais enfant et que j'utilise encore aujourd'hui (j'ai 48 ans).Avant d'acheter quelque chose, pose toi la question de savoir si tu en as vraiment besoin ou si en a juste envie et attend le lendemain avant de l' acheter. Si tu en as juste envie, tu n'as besoin de l'acheter donc tu peux mettre cet argent de côté et l'économiser.Joyeuses fêtes à tous et bonne année pour 2013.","1","1",NULL,"2012-12-25 16:27:23"
"20791","0","2868","2","Hello misssi tu veut copier le look d'hanna j'ai une page facebook qui viens juste de démarrer c'est : Les tenues de Pretty little liars !voila va vite voir ! ","0","1",NULL,"2012-12-26 17:52:42"
"20795","0","251","2","Coucou, J'ai 14 ans et mesure 1m60, qu'en pensez vous de cette taille ?Moi perso, je me trouve trop petite, tout le monde me dépasse, je me sens naine et très complexée. Mes parents sont quand même grands enfin surtout ma mère 1m72 et mon père 1m75 et dans ma famille aussi ils sont grands. Grands parents 165-192 Tante : 184...Je devrais faire 1m66 à l'âge adulte, c'est trop petit pour moi qui avait rêvé les 1m80... Rien qu'à l'idée d'y penser ça me rends malade...Mais c'est ce qu'à dit mon docteur mais sa méthode du additionner la taille des deux parents, enlever 13 et soustraire par 2 ne fonctionne pas pour tout le monde pour la sœur de ma mère ça n'a pas marché !En plus après les règles on ne grandit presque plus et ça va faire 3 ans que je les ai. Les filles en plus grandissent que jusqu'à 16 ans m'a dit mon docteur et par contre il trouve cela bizarre que je ne dépasserai pas ma mère parce qu'il a dit en général les filles dépassent leurs mères.Quelle solution pour être plus grande à part les talons.? J'aimerai gagner au moins 15 centimètres mais il me reste 2 ans et ma croissance est gazi terminée. C'est possible de prendre 15cm en 2ans quand on a en plus nos règles et donc on grandit moins vite... ? Des réponses svp.","0","1",NULL,"2012-12-26 23:37:39"
"20805","0","2881","2","J'ai une question, si on s’arrête a 5mm l'oreille peut redevenir comme avant ?","1","1",NULL,"2012-12-28 14:27:47"
"20814","0","3098","2","Aucune panique, tout le monde est passé par là ;)","0","1",NULL,"2012-12-29 18:44:15"
"20818","0","730","2","Moi aussi je sors avec mon cousin et sa n a pas ete facil de le dire a mes amis et beaucoups de gens m on juger mais je l aime et sa va faire 11 mois qu on sort ensemble et on est tres heureux comme sa! Moi je dis fuck l avis des autres c est pas leur vie j vois pas de quoi ils se melent!! ","1","1",NULL,"2012-12-30 03:21:49"
"20821","0","193","2","Salut voila sa fait 2 ans que je suis avec mon amieTout ete si fusionelle au depar et la elle et tomber enceinte On a decider de le garder se que je ne regrette pas et elle non plus Mais au bou du 7 eme moi elle a commencer a me metre de coter A ne plus me toucher rien Et par ereur ou manke d'afection j'ai discuter avec des femme sur le netEn et rencontrer une et c'est tt de suite passer on c'est separer Mais notre amur ete plus fort on c'est remi enssenble aujourd'huit on et sur le poing de se separer a cause de mon ereur commen je peu ratraper svp médame  je tien a elle et l'aime plus que tt c'est une ereur qui ne se reproduira plus je veu finir ma vie avec et l'eepouser je les demander en mariage ","1","1",NULL,"2012-12-30 12:57:07"
"20825","0","935","2","bamm","0","1",NULL,"2012-12-31 03:59:11"
"20824","0","974","2","Moi personnelement , j'ai rencontré qqun pendant mes vacances d'aout en 2010 , j ai passé 10 jours magnifiques avant , on a continué a correspondre , casi tout les jours on se parlait puis il y a eu des tensions , manque de confiance , disputes qui ont fait que l'on s'est \" séparé \" , nous sommes allés avec dautres mais apres 1 mois ou 2 nous sommes retournés ensembles , nous nous sommes revu , puis apres l année qui a suivie de nouveaux la meme chose , on se disputait , se separait , se remettait sans cesse , et quand on etait en dispute on essayait de rendre l autre jaloux etc . ca a duré ainsi pendant presque 2 ans puis en juin 2012 on s'est vraiment séparés on est resté amis on se parle encore regulierement , mais le probleme c'est qu il y a toujours qq chose entre nous , on peut pas s'empecher d aimer l autre ,et on peut pas oublier qqun ainsi","0","1",NULL,"2012-12-30 23:45:12"
"20826","0","647","2","J'ai été chez le coiffeur il y a deux jours. J'avais une frange droite et je les mise sur le coté gauche tout en ayant un épi a droite de la frange. Et quand je me suis lavé les cheveux, en les séchant je n'est pas réussi a discipliné mon épi. Je sais pas comment faire :/   ","1","1",NULL,"2012-12-31 13:41:40"
"20827","0","578","2","Salut j'ai kelqun et on veut sembrasser lui il à déjà un peu d'éxperience mais pas je sais pas comment l'embrasser???? Au secours aidez-moi","1","1",NULL,"2012-12-31 19:26:24"
"20830","0","677","2","bonjour, j'ai des cheveux blonds, épais, ondulés et mi-long et je peux en faire ce que je veux !-Lisses au naturel : 1)aprés s'être lavé les cheveux, se les sécher tout en se les brossant.                     2) aprés s'être laver les cheveux les sécher et utiliser un lisseur ( cela abîme beaucoup les cheveux !!!)                     3) SI vous avez les cheveux naturellement lisses laissez les à l'air sans les sécher.-Ondulés ou frisés : 1) aprés s'être laver les cheveux laissez-les a l'ir si ils sont ondulés ou frisés naturellement.                     2)aprés s'être lavé les cheveux les enrouler dans une serviette et la garder au moins 8-10 heure. conseil: le faire le soir et garder la serviette pendant toute la nuit( c'est ce que je fais et le résultat est super !).                     3) mettre des bigoudis(je n'ai jamais essayé) dans vos cheveux et sécher les cheveux en gardant les bigoudis.voilà j'espère que tout ceci vous sera bien utile !! =)","1","1",NULL,"2013-01-01 19:29:40"
"20829","0","966","2","BONJOUR TAL ON TAIME DE TOUT NOTRE COEUR DE LA PARE ILONAET ATALIA!TES VAITEMENS SONS LES PLUS BEAUX!TES CHAUSSURES SONS LES PLUS BELLE!","0","1",NULL,"2012-12-31 23:17:30"
"20831","0","3487","2","Cc je suis votre premier fan!!!!!!!:-)Je vous adors;-)","0","1",NULL,"2013-01-01 22:55:59"
"20833","0","3487","2","Moi j'me balade sur balader:\"imbécile,jdirais même que t'es con, à vouloir nous faire des croches pieds à garder tes pompes\" voilà, mais vous l'avait pas compris, je suis une faneeeee","0","1",NULL,"2013-01-02 12:48:32"
"20834","0","444","2","BonjourJe suis journaliste pour la chaine de télévision Chérie 25, et je prépare un reportage sur le thème de l'amour entre prof et élève. Je recherche actuellement des personnes qui souhaiteraient témoigner et donc participer à ce reportage. Je vous invite à me contacter pour me raconter votre histoire. Ce sera aussi l'occasion pour moi de vous expliquer mon projet de reportage en détails.A bientôt, et bonne journée!Béatrice, journaliste.01 40 74 76 59beatricejournaliste@gmail.comElectron Libre Productions – Groupe Lagardère","0","1",NULL,"2013-01-02 13:08:31"
"20835","0","444","2","\"Anonyme a écrit (2012-12-16 16:12:59) : Coucou, désolée d'intervenir si tard dans la conversation mais moi j'ai moi aussi rencontré ce genre de situation cocasse x). J'ai eu mon permis au bout de 4 mois de conduite et le moniteur en question a pris contact avec moi peu de temps après. L'âge n'est pas un frein, j'ai 19 ans, lui 54 et nous sommes aujourd'hui ensemble depuis plus de 6 mois et somme très heureux ensemble. Bisous à tous!\"Bonjour, j'aimerais rentrer en contact avec vous. A bientôt!Béatrice, journaliste.01 40 74 76 59","0","1",NULL,"2013-01-02 13:10:10"
"20837","0","730","2","et bah moi cela va faire 2 ans je suis avec un cousin éloigné,prsnne le sais ni famille,ni amie. on se cache tout le temp,cst dur c'est vrai,mes on fait avec. j'ose rien dire car de mon côter,il vont tres mal l'accpter. que de son côter tres bien meme s il se doute!","0","1",NULL,"2013-01-02 21:52:26"
"20839","0","2226","2","Elles peuvent porter \"tout ce qu'elles veulent\" ?!Moui enfin.... Je pense à cette robe bustier à laquelle j'ai du renoncer une fois, la taille étant parfaite sauf au niveau de la poitrine que je ne remplissais pas.... Et toutes ces jolies nuisettes qu'il faut prendre en taille minimale et serrent les hanches, pour ne pas avoir l'impression d'être vide au niveau poitrine. Des exemples comme ceux-là, il y en a des centaines. Porter tout ce qu'on veut, non, loin, très loin de là.","0","1",NULL,"2013-01-03 17:53:10"
"20845","0","451","2","je comprend que si on a une soeur jalouse ect mais qui est morte se soit dur, mais bon par ce que on peut mourrir a tout moment , on doit laisser tout passer? Je suis desoler mais si la personne malgrés tout nos efforts n'en fait aucun , je vois pas comment on pourrais ne plus souffrir juste en se disant attention on sais jamais on peut mourir ; nen pour ma part je peux pas ne rien ressentir et étoufer mes emotions pour que tout se passe bien c'est impossible. On se dit peut-être quand la personne n'est plus là que ce n'etait rien surement, je ne sais pas, moi j'ai une amie qui me parle plus çà m'a fait trés mal, j'ai esseyer qu'on se réconcilie, rien, ben c'est sur si jamais un jour il lui arrive un truk, je serais enormement triste et je m'en voudrais de cette situation qui aurait comme çà mais ce n'est pas moi qui l'ai voulu quoi.","0","1",NULL,"2013-01-04 15:34:32"
