"id_com","id_membre","id_contenu","id_type","commentaire","abonner_fil","statut","pseudo_v1","date_post"
"20186","0","683","2","je trouve sa tres interessant mais domage ce n'ai pas ce que je recherche","0","1",NULL,"2012-07-24 18:07:40"
"20188","0","3138","2","Faire du baby-sitting pour mettre un peu d'argent de côté est une bonne idée.Ensuite, il est important de te demander à quoi va te servir cet ordinateur : qu'utilises-tu sur l'ordinateur fixe (logiciel, internet, suite bureautique, ...). Que va t'apporter cet ordinateur portable par rapport au fixe, ...","0","1",NULL,"2012-07-24 20:12:26"
"20189","0","806","2","Bonjour, 'anne' on a le même problème je suis aussi esthéticienne dans le domaine, je te conseille de te mettre en valeur avec des jupes et des robes amples et courtes tout en gardant ta discrétion, je te conseille aussi de mettre beaucoup d'accessoires, bon courage ","0","1",NULL,"2012-07-24 22:18:11"
"20190","0","3046","2","merci j ai arreter avec lui il et ps sincere d autant plus qu il me repete je voudrais pas te perdre il ma jeter 2 fois de fcbook pui 3 fois par msn et me rajoute quand sa lui prend et il retire ses amis du blog et reprend je pense qu il s amuse avec nous de meme qu il me dis je t aime je t aimmmmmmmmmmme pffff sa m interresse pas du tout merci bcp de votre reponse ............","0","1",NULL,"2012-07-25 21:41:43"
"20195","0","2951","2","Jaimais quelqun a lage de 13 ans cetait lamour fou puis il ma devierger a lhotel devant un fr ses potes pendant le mois du ramadan car jsuis algerienne ","0","1",NULL,"2012-07-26 19:27:39"
"20196","0","1352","2","bonjour, moi c emmanuelle j'ai 19ans jaimerai adopter une nouvel coupe de cheveux mi-lomg. j'ai le visage ovale quelle frange me conviendre le mieu?et quelle coupe adopter? je suis cafrine avec les cheuveux frise c'est pa evidan!....merci d'avance ","1","1",NULL,"2012-07-27 11:26:00"
"20198","0","578","2","Mw's sa fais 7 mois que je sort avec un mec on se faiit des pt'it bsx comme sa et le probleme c'est qu'on est tt les deux un peu timide et qu'on veux tt les deux s'emballer mazis aucun de nous deux ose faire le premier pas.. Est que kelkun peut me diire comment m'y prendre et surtout a quelle moment le faire??? Stp c URGENT ... Merci bsx","0","1",NULL,"2012-07-28 20:07:21"
"20199","0","2341","2","ou  est-ce quon peut se le procurer ?? :o","0","1",NULL,"2012-07-29 16:07:59"
"20201","0","867","2","Coucou les filles moi ma mère est pas très cool pour le maquillages...J'ai pas le droti au mascara fond de teint et crayon après je peut vous pensez que ca va pour quelques jours a Paris ou dans la rue ?? Merci","0","1",NULL,"2012-07-29 20:44:38"
"20202","0","867","2","Je sais pas quoi faire pour lui dire que je veut mettre du mascara et du crayon :/","0","1",NULL,"2012-07-29 20:46:05"
"20203","0","1700","2","coucou je sais que ce sujet date mais bon !!!  Voilà je vais bientôt avoir 16 ans et je vais voir l'orthodontiste bientôt, je sais qu'un appareil, n'est pas très facile à digérer niveau esthétique et moral surtout à cet âge. Mais bon alors moi si l'ortho' me dis que je dois en mettre un, je vais opter pour l'invisalign, mais bon ma question est : vu que j'ai encore 15 ans bientôt 16 dans deux moi je voulais savoir si j'opte pour cet appareil,  est ce que ça sera gratuit comme l'appareil normal ou pas :/ ??? car oui j'ai le même problème toutes les personnes que je connais l'on enlevé, et moi je dois en mettre un ça me dérange aussi enfin peut être mais bon je suis, très complexé par mes dents du bas et une d'en haut donc voilà je voudrais bien une réponse *,* Mercci beauccouuppppp et bonne chaance à toi même si je pense que tu l'as enlevé x) ","0","1",NULL,"2012-07-30 06:39:24"
"20206","0","2239","2","merci pour les conseils, maintenant j'utilise un bon produit, c'est le capillaire huile d’argan marocaine Pro Naturals qui renforce les cheveux et les laisse sains et brillants. :D","0","1",NULL,"2012-07-31 03:04:43"
"20207","0","2064","2","merci pour l'info, j'utilise un bon produit qui m'a aidé beaucoup, c'est le traitement capillaire huile d’argan marocaine pro naturals qui renforce et restaure les cheveux. :)","0","1",NULL,"2012-07-31 03:30:54"
"20209","0","2196","2","merci pour l'info, maintenant j'utilise un bon producit pour reparer mes cheveux, c'est le traitement capillaire huile d’argan marocaine Pro Naturals qui fonctionne rapide et très bien. :) ","0","1",NULL,"2012-08-01 01:25:09"
"20211","0","473","2","C'est ca que j'ai fait mais aussi mon lisseur et vraiment nul --'","0","1",NULL,"2012-08-01 13:16:20"
"20214","3638","3096","2","Moi je te suggère de camoufler t'es imperfections avec un anti cerne et ensuite mettre une poudre libre, ayant moi même la peau mixte, c'est ce que je fais, bisous","1","0",NULL,"2012-08-03 10:14:02"
"20216","0","2518","2","Bonjour,Je souhaiterais faire mon stage de 3ème dans un magazine féminin mais je n'ai aucune adresse pourriez vous m'en communiquer quelques une.Merci d'avance","1","1",NULL,"2012-08-03 15:20:34"
"20219","0","3156","2","et des formes quelque peu pulpeuses (des bonnes fesses rebondies, des hanches marquées, des cuisses galbées...), Et bah dis donc, t'es pas un pretentieuse un peu toi ? :)","0","1",NULL,"2012-08-03 16:37:37"
"20220","0","578","2","Hey les filles, suiver les conseils de Sandy ils sont vraiment bon et laisser faire si c'est le bon (le repousser pas psk vs fliper) je vais vous dir la meme chose qu'on entend partout: sa viendra tout seul, pas besoin d'entrainement laisser vous guider pas votre partenaire! =)","0","1",NULL,"2012-08-04 02:49:31"
"20221","0","847","2","Bonjour à tout le monde ","1","1",NULL,"2012-08-04 13:22:21"
"20222","0","2761","2","bonjour j'ai un problème .. Voilà mes cheveux sont frisés naturellement.. Un jour  ma soeur m'a donné des masques qu'elle n'utilisaient plus, j'en ai utiliser un sauf qu'après le rinçage de celui ci mes cheveux  sont devenus tout plats et je n'avais plus mes cheveux frisés ! J'ai essayé de les re laver plusieurs fois avec du shampoing sauf que nous sommes au mois d'août et je n'ai toujours pas récupéré mes frisottis ( ils re-frises à la racine mais pas sur les longueurs ) je perd espoir de les revoir frisés ..que dois je faire pour retrouver mes cheveux frisé??","0","1",NULL,"2012-08-05 13:53:43"
"20225","0","1342","2","Bonjour je perd également mes cheveux depuis un bon bout de temps j'ai essayer pas mal de chose tel que le traitement de piqure biotine et bépanthéne 3 piqure par semaine pdt 6 semaines, les huiles de jojoba ricin et nigel. les shampoing anti chute acheter en pharmacie, les géllules de biére, et un traitement de minimum 3 mois de conprimer anacaps. a 18 ans perdre c cheveux c horrible, avez vous connaissance d'un produit ou de quelque chose qui stop la chute et renforce le cheveux, j'ai toujour eu les cheveux fins mais la c vraiment vraiment trés fins. j'ai perdu ma maman il y a un an sa a été un choc émotionnel peut étre que c un facteur qui a influencer ma chute ?!! aidezz moi svppppp je déprime énormément a cause de sa ( j'ai couper mes cheveux court on ma dit que sa pouvai les aider)","1","1",NULL,"2012-08-07 17:46:53"
"20226","0","560","2","Sex.","0","1",NULL,"2012-08-08 01:16:17"
"20227","0","3024","2","sans vouloir te vexer, ce que tu as écrit ce ne sont que des trucs que les parents disent a leur enfants...mais ils ne comprennent pas ce que on peut ressentir.les gens comme moi qui sont tres timide et qui n'ose pas faire le premier pas pour se faire de nouveaux amis sont super stresser a l'idée de rentrée a l'ecole ...honnetement, moi je vais rentrée en 3eme secondaire et j'ai des amies que je connais depuis longtemps, mais la question que je me pose c'est : \" est-ce que je vais me retrouver dans la meme classe qu'elles ou je vais me retrouver qu'avec des gens que je ne connais pas ?et a force de se dire sa on stresse de plus en plus quand la rentrée approche ! et moi je ne sais pas comment me faire de nouveaux amis, surtout que j'aimerais avoir une réputation de fille sympa et cool, pas forcément populaire mais voila quoi ...j'ai lu plusieur conseil sur internet de gens dans le meme cas que moi et je n'ai trouver que des reponses du genre : reste toi-meme, soi souriante etc..., sauf que ces reponses la, ça n'aide mais alors pas du tout.pour nous les gens timide, il nous faut des conseils, des methodes pour se faire des amis sans etre rejeter ou passer pour une conne !!!","1","1",NULL,"2012-08-08 21:53:15"
"20229","0","730","2","jaime mon couz mai je veu pa vivre avec lui et le dire a la famille mai jarrive chai pa quoi faite ","0","1",NULL,"2012-08-09 15:08:25"
"20230","0","631","2","j'irai chez le coiffeur dans une semaine et j'ai envi de tester une nouvelle coupe ,mais je sais pas trop quelle coupe m'irait!j'ai le visage carre , le teint bronze et les cheuveux mi longs,tres epais et ondules!que me conseillez vous?","1","1",NULL,"2012-08-09 15:27:21"
"20231","0","608","2","jai 58ans et je suis tjr vierge pour moi une femme ki né pas vierge c une***stop et fin.","1","1",NULL,"2012-08-09 16:15:52"
"20232","0","608","2","jai 58ans et je suis tjr vierge pour moi une femme ki né pas vierge c une***stop et fin.","1","1",NULL,"2012-08-09 16:17:58"
"20233","0","473","2","coucou C la premier fois que je decouvre cette page il y a plusure fois que mon namie ma dit cette mais JT pas vraimant sure d'elle mias C la premier fois que jeV ECier.je vais vous dir apres ok.bye","0","1",NULL,"2012-08-09 16:49:45"
"20236","0","1799","2","Bonjour, je c'est que c'est un peu tard mais peut etre que d'autre femme dans ton cas en aurais besoin. Voilà a mon avie je serai resté comme je suis(aucune chirurgi...) et j'en n'aurais parlé a mon futur mari et puis s'il t'aime vraiment il t'aurais compris il ne faut rien lui caché! en+ il y a 50% de chance que tu segne et puis comme de disais tous a l'heure, moi j'ai u le meme problemme que toi et j'en n'est parlé il m'a compris. Ecoute ton coeur et c'est pas un petit bou de peau a peine déchiré qui devrai te gaché la vie meme si je c'est que c'est importen ... CORDIALEMENT.","0","1",NULL,"2012-08-10 13:35:03"
"20239","0","2890","2","euh perso c a toi de voir mais bon. tu as le meme visage que moi donc je te conseile la frange.","0","1",NULL,"2012-08-12 18:30:22"
"20240","0","473","2","merci pour les conseils, sont très bons, j'utilise un autre produit pour mes cheveux, c'est traitement capillaire huile d’argan marocaine Pro Naturals qui est génial. :P","0","1",NULL,"2012-08-13 20:00:21"
"20247","3693","1973","2","Hello Camie, j'ai eu mes regles a 15ans et toutes mes amies les ont eu a 13 14 ans jetais la seul de ma classe a ne pas les avoir. Et je continue a me deveopper aussi et j'ai 16ans. Bisous","0","1",NULL,"2012-08-15 22:24:12"
"20245","0","974","2","Je vis exactement cela en ce moment tout était parfait pendant un mois, on s'est promis de se revoir etc une semaine après mon retour il ne répond plus à mes messages, mes mails et je remercie la psychologue pour cette réponse, parce que ça me fait prendre conscience que c'est exactement ça: j'ai bien trop idéalisé cette relation!Il ne faut garder que les bons moments passées, parce qu'une fois les vacances terminées, on est plus dans le même état d'esprit. Au lieu de déchanter, ne garder que les bons souvenirs, et profiter du moment! parce que bien évidemment même si un jour on est amené à se revoir, rien ne sera comme le merveilleux mois qu'on aura passé ensemble!","0","1",NULL,"2012-08-14 16:59:12"
"20248","0","1996","2","jaime","0","1",NULL,"2012-08-16 13:23:25"
"20249","0","1638","2","Je suis dans le même que vous, je n'ai pas de copain, je suis a peux à peu près la seule de mes amies à ne pas en avoir et en plus je suis pratiquement la plus agées, j'en ai marre de voir tout ses couples qui s'embrassent et je me sens très seule, je pense que c'est d'abbord dû au fait que j'ai été très longtemps amoureuse dun garçon et que ça n'à rien donner, que je suis une grosse timide, réservée et que il m'arrive d'être sèche avec les mecs sans m'en rendre compte mais je suis aussi hyper exigeante et que il y a qu'un seul style de mecs qui m'interresse...Je me trouve pas très belle et puis je me vante pas mais j'ai quand même une super personnalitée donc on verra peut-être qu'avec le temps, je vais trouver de mature qui voit au delà de l'aspect physique et qui me regardera plus pour la personne que je suis :)","0","1",NULL,"2012-08-16 18:35:14"
"20251","0","1984","2","OUI il faut surtout de la volonté sans ça vous ne pourrez pas y arriver ","0","1",NULL,"2012-08-17 15:11:46"
"20252","3697","3043","2","faire du baby sitting ou encore aider dans le travail ménager plusieurs familles... Tu te ferais plein de sous... Ne cherche pas de travaux trop durs et à longs termes!","1","1",NULL,"2012-08-18 01:01:15"
"20255","0","1271","2","bonjour ! les meuf salut a tous , j'etais deja amoureux 3 fois g echouer la 4 etai une pute mai serieux si je suis amoureux et qu\"elle me dit je taime puis g un autre homme dans ma vie \"sa c dja arive\" je lui claque la porte jme casse a jammais apres si elle fai chier jlui en colle une bonne centaine de patéé apres oui ... g 11 an je passe au college jattend la surprise si c du harcelement je pete le college entier a pres tout je vous dit tchaaaaooooo !                       PS: je suis drageur","0","1",NULL,"2012-08-18 23:33:06"
"20256","0","3138","2","Moi mon ordi portable je l'ai eu a l'âge de 13 ans. Je fesais que de lui demander tout le temp alors a force sa la saouler donc elle me la acheté. ","0","1",NULL,"2012-08-19 01:47:22"
"20257","0","244","2","BonjourJe pense que faire un enfant est la suite logique d'une relation de couple dans le mariage.Il est vrai que le desire de maternité est plus fort chez la femme que chez l'homme.Il est important de ne pas se leurrer surtout en debut de relation, il faut aller dans le même sens pour que le couple tienne.Si un homme ne veut pas d'enfant c'est son choix et si une femme en veut c'est aussi son choix.Il faut surtout pas se cacher sous l'amour et fait faire n'importe quoi à l'autre .Si vous n'êtes pas dans le me^me direction ,pourquoi insister et se donner des souffrances initules.Vous voulez des enfants l'autre ne veut pas alors qu'est ce que vous faites ensemble?Fuyez ses personnages qui ne vont pas dans la meme direction que vous , homme ou femme d'ailleurs. Monsieur vous fait clairement savoir souvent depuis le debut qu'il n'en veut pas madame ayez le courage de partir.surtout quand on est encore jeune et qu'on peut refaire sa vie.Maintenant si vous decidez de restez , apprennez la patience voir faire le deuil de ne pas être mere mais ça, cela va etre difficile ou se contenter de d'autres bonheur dans la relation.Tout cela montre qu'on est encore dominé par l'homme dans la société.Un homme n'en veut pas son epouse doit user de toutes les strategies pour ne pas contrarier ce cher monsieur, arrondir les angles, être patiente etc au risque de perdre son temps et ne jamais etre mereet si c'est la femme qui ne veut pas ou ne peut pas en faire il n'hesiterai pas à se barer avec un autre ou lui faire dans son dos à une autre.Moi je suis dans la même situation avec un homme vraiment merveilleux. J'ai trois enfants dune premiere union et il est bon bon beau pere pour mes enfants nous avons une famille vraiment unie. Pour finaliser cette belle relation j'ai desirer un enfant de lui , lui n'en voulait pas et ça depuis e debut.Que des larmes et de souffrances pour moi et aussi pour lui d'ailleurs ,jusqu'à present je n'ai toujours pas compris son refus mais quel casse tête pour comprendre ses personnages moi j'abandonne. avec du recul je me suis dis tant pis pour lui, finalement je suis la mieux loties .Trois beaux enfants d'un cretin mais un beau pere formidable qui a bien élévé mes enfants, une belle maison , une situation confortable, et un homme qui m'aime qui est a petits soins une complicité incroyable que du bonheurAlors pourquoi gacher tout ça pour un enfant qu'il en veut pas et surtout que moi même je suis deja mère .Mais par contre je n'aurai pas eu d'enfants alors la avec toutes les bonnes qualités qu'il a je serai partie.A chacun de prendre ses responsabilités","1","1",NULL,"2012-08-19 13:05:51"
"20263","0","3209","2","Mais nous n'avons pas le droit aux jupes ni aux robes dans mon collège.. Comment faire?","1","1",NULL,"2012-08-22 12:47:04"
"20267","0","578","2","bonjour, ca fait a peu pres un moi que je sors avec un gars et ce fut pour moi la premiere fois que j'emballer un mec alors je vais vous donner mon conseil et les erreur a ne pas faire que j'ai malheureusement faite ^^' pour commencer essayer de laisser duree un minimum le baiser parce que sinon le mec se sent ... frustré ^^' ensuite il faut bien ouvrir la bouche parce que c'est juste hyper desagreable de sentir les dent de l'autre XD et enfin il ne faut pas se forcer :) voila voila j'espere que ca vous aidera les filles :) bisous","1","1",NULL,"2012-08-23 15:12:36"
"20273","0","2038","2","il me falait sa :)","0","1",NULL,"2012-08-24 19:09:21"
"20274","0","2519","2","que conseillez vous de porter avec un pantalon en cuir lorsque l'on est pulpeuse du bas et tres fine du haut ? ","1","1",NULL,"2012-08-24 19:55:56"
"20275","0","1109","2","Bonjour,","0","1",NULL,"2012-08-25 02:36:56"
"20276","0","1942","2","Bjr a tous jai 12 ans jai eu mes regles pour la premiere fois en fevrier pendant 5 jour et depuis plus rien !!!! Aidez moi svp ","0","1",NULL,"2012-08-25 16:20:24"
"20280","0","218","2","La face collante ou la face non collante du bout de scotch ?","1","1",NULL,"2012-08-26 20:19:54"
"20281","0","2985","2","Merci pour les conseils !! ","1","1",NULL,"2012-08-26 21:30:28"
"20283","3714","3157","2","Moi je pense que tu ne devrais pas \"t'interdire\" une relation avec ce garçon à cause de ton papa. & si tu dis que ce garçon va travailler avec ton père, vois y une très bonne opportunité pour le voir un peu plus & donc te rapprocher de lui. Si il est timide & quil n'ose pas faire le premier bah fais le toi, tu n'auras rien à perdre ;)!En tout cas j'espère que tout se passera bien pour toi, bye :)","0","1",NULL,"2012-08-27 00:09:34"
"20284","3714","3077","2","Je suis un peu dans le même cas que toi. Je suis sortit avec un garçon pendant juste un mois je l'ai quitter car je pensais ne pas l'aimer sauf que je l'ai amèrement regretter. Je suis donc sortit avec d'autres garçons pour essayer de l'oublier sans grand succès. Ça va faire 2ans que je ne suis plus avec lui. En novembre dernier je suis sortit avec mon copain avec qui je suis depuis plus de 9mois, je l'aime sincèrement. Mais mon ex me hante toujours, quand je le recroise ou quand je vois qu'il vit une histoire d'amour via facebook ça me fait très mal.  Enfin voilà je me dis qu'il ne sera plus jamais à moi, qu'il m'a sûrement oublier donc qu'il faut que je l'oublie moi aussi .","0","1",NULL,"2012-08-27 00:17:40"
"20286","0","3211","2","Merci pour l'aide je vais tout de suite contacter un psy dans mon pays","1","1",NULL,"2012-08-27 17:12:04"
"20289","0","3110","2","Salut à tous, je me présente je m'appelle Chloé et je suis en Art-Appliqué et cette année je passe en 1ère. Et nous avons beaucoup de matériel d'Art et je ne sais pas comment les transporter sans les casser.Donc j'aimerai savoir si quelqu'un a déjà vu un sac qui pourrait correspondre, si oui pouvez vous  me répondre le plus vite possible donc avant la rentrée, je vous en remercie d'avance. bisous","1","1",NULL,"2012-08-28 16:11:28"
"20291","0","691","2","baptiste labydoire: bonjour je m'appelle baptiste et j'ai les cheveux tres tres longsalut !","0","1",NULL,"2012-08-28 20:32:08"
"20292","0","152","2","Moi aussi, j'ai les cheveux très frisés et très abimés car j'ai fait un défrisage (il y a 2 ans) et je mets de l'huile de noisette depuis un an et cela les répare peu à peu mais je cherche toujours de nouvelles astuces.","1","1",NULL,"2012-08-28 21:12:35"
"20295","0","3076","2","Bonjours ! Moi aussi, depuis deux semaines, je ne rêve presque que de ça... c'est vraiment horrible. Dans ce cauchemars, mon père est présent et ne me viens pas en aide, et fais comme si il ne voyais rien ( c'est toujours comme ça ). de même, les lieux change, mais au fond, il se passe toujours la même chose. des gens rentrent chez moi par effractions, et finnissent par me violer... j'en ai vraiment marre !! je n'arrive plus à dormir...Pourquoi ? est-ce que c'est lié à un souvenir ? ( je n'ai que 13 ans, et je suis tombée sur ce sujet en faisant des recherches sur mon cauchemars.. ) Alors j'ai pas fais d'étude en psycho... ^^'Merci !","0","1",NULL,"2012-08-29 17:17:54"
"20296","0","647","2","J'ai le meme probleme, jcrois que on ne peut rien faire pour lutté contre un épi..","0","1",NULL,"2012-08-29 23:48:31"
"20297","0","1702","2","Il faut 9 mois au piercing pour cicatriser completement , mais tu peux changer le bijou au bout de 2-3 mois, en ce qui est de la douleur, elle est minime.. Comme celle d'une prise de sang :) Si vous avec d'autres questions je suis là :)","1","1",NULL,"2012-08-30 00:17:22"
"20298","0","1983","2","coucou bin voila jai 13 ans je fais du 80a) de poitrine jai tout les jours des petres blanche .. sa menerve car je veut avoir mes regles plus tot que prevue ... ma meilleur amis a 11 ans elle a deja ces regle !! je les veut mes regle !! ","0","1",NULL,"2012-08-30 04:42:24"
"20299","0","-1","2","1","1","1",NULL,"2012-08-30 15:59:37"
"20300","0","1271","2","1","1","1",NULL,"2012-08-30 15:59:37"
"20301","0","1271","2","1","1","1",NULL,"2012-08-30 15:59:38"
"20304","0","381","2","Coucou ! J'ai 11 ans et je passe bientôt en 6e je suis grande et très mince (1m63 environ pour 36kg..) comment je peut m'habiller ? ","0","1",NULL,"2012-08-31 00:23:23"
"20305","3692","3204","2","merci ","0","1",NULL,"2012-08-31 13:07:29"
"20308","0","867","2","Salut, je vient juste pour repondre a certain message qui demande si 13 ans sais tros jeune , si sais pour ce maquiller comme des voiture volée oui sais jeune :D si sais discret pourquoi pas . Vous savez les parents ont juste peur de vous voir grandir tros vite ;) et moi perso je ne pense meme pas encore au maquillage j'ai 12 ans mais perso e maquilllage ne m'interesse pas encore :) je suis juste passer pour regarder les age moyen ou vous avez commencer :) car une copine qui ce maquille demande souvant si elle a l'age (13ans ) :)bisous et bonne chance avec votre mascara pas de tache partout un :)","0","1",NULL,"2012-09-01 05:18:39"
"20310","0","1133","2","Bonjour moi sa doit faire 2 soir de suite que je fait l'amour avec mon copain et que sa me fait mal en bas du ventre et j'ai l'imprétion que sa me donne des coups de couteau c'est horrible et cela me fait que quand je suis sur lui. Sa pourait venir de quoi ?? Svp pouvez vous repondre a ma question ?? ","0","1",NULL,"2012-09-01 20:13:15"
"20313","0","3149","2","j'ai aussi les yeux bleu et je met un dégradée de rose et de gris et sur la paupiere je mais un trait fin de crayon noir mais pas crayon noir en dessous de l'oeil sa fait pas trée beau et sa rent tes yeux petits tu mes beaucoup de mascara noir et au levres tu met un gloss rose mais pas beaucoup voili voila <3","0","1",NULL,"2012-09-02 16:14:18"
"20316","0","338","2","Bonjour:J'ai rencontré mon amoureux dans un site sportif il y a presque 3 ans. Moi, mariée et lui aussi. Lui 15 ans plus àgé et 2000km nous séparent. Lui, en couple depuis 30 ans, moi depuis mes 14 ans et 3 enfants...une histoire de dingues...bref, j'ai quitté mon mari après nous avoir, mon amoureux et moi, rencontrés et nous rendre compte que c'était concret ce qui nous arrive, et non une amourette virtuelle. Lui, marié à une femme névrosée avec tentatives de suicide. Elle m'a harcelé moi, mes enfants, la famille de mon ex. Elle est violente et déséquilibrée, dépendante de lui et n'acceptait pas de le laisser partir avec des menaces très sérieuses s'il partait. C'était tellement dur qu'à moment donné, j'ai laissé tomber; mes enfants me rejetaient, mon ex me rendait la vie dure....un cauchemar. Il est arrivé à débloquer la situation et cela fait plus d'un an qu'il l'a quittée. Il a déménagé dans un appart en attendant de pouvoir me rejoindre. Et bien oui, ce fut très dur mais ça vaut la peine car ce qui nous unit est avnt tout une complicité merveilleuse et une tendresse absolue. Ni lui ni moi sommes des gamins et je vous assure qu'on a bien réfléchi avant d'en arriver là. J'ai perdu ma fille dans le chemin, elle continue à ne pas me parler, ma situation économique est très précaire mais j'ai de l'espoir et je sais qu'à la fin, avec du sacrifice et de la volonté, tout ira mieux.Il ne faut pas juger. Une personne n'est pas un objet, on a un projet et on fait tout pour l'accomplir mais les personnes ne nous appartiennent pas...l'ex de mon amoureux continue à ne pas accepter la séparation et se conduit comme si ceci éatit temporaire, elle pense qu'il reviendra...bref, elle nie la réalité et cela me fait beaucoup de peine pour elle","0","1",NULL,"2012-09-03 08:53:08"
