"id_com","id_membre","id_contenu","id_type","commentaire","abonner_fil","statut","pseudo_v1","date_post"
"21086","0","185","6","moi je l ailouper a la television et je trouve pas de site ou on pourrai le voir donc je suis d acord avec la personne qui a ecrit le 4-4-2011","1","1",NULL,"2013-02-19 11:31:24"
"21049","0","255","6","jadore tal ","1","1",NULL,"2013-02-12 16:23:15"
"21036","0","255","6","Je trouve qu'elle a du potentiel mais malheureusement elle m'a déçu. Je pensais que les artistes ne prennaient pas partie danse les débats actuels dans leurs musique, pour nous libérer l'esprit de nos problèmes. Et quand j'écoute \"on avance\" on se rend compte qu'elle fait de la propagande, concernant le conflit Palestine/Israël. Et je trouve cela vraiment nul. D'ailleurs je ne l'ecoute plus","0","1",NULL,"2013-02-10 01:00:59"
"21257","3003","541","6","Nan mais allô! allô allô allô! trop conne cette fille cest pas possible... ou alors elle le fait exprès pour faire le buzz : je sais pas c'est juste pas possible d'être aussi bête (la guerre mondiale de 78)...","0","1",NULL,"2013-03-17 12:26:29"
"21280","0","255","6","j'adooooooooooooooore!coooooooooooooooool!","0","1",NULL,"2013-03-22 19:43:07"
"21298","0","255","6","Je trouve tal tres magnifique et elle a la plus belle voix du alors arreter de  l insulter vous vous faite du mal","0","1",NULL,"2013-03-27 15:22:10"
"21299","0","255","6","Et puis je l aime de tout mon coeur","0","1",NULL,"2013-03-27 15:28:11"
"21339","0","521","6","Il est magnifique c'est mon fantasme","0","1",NULL,"2013-04-05 14:22:56"
"21376","0","255","6","JE DETESTE TAL !!!!!!!!!!!!!","1","1",NULL,"2013-04-12 15:08:59"
"21438","0","255","6","Elle est nulle ! Sa musique est nulle !","0","1",NULL,"2013-04-27 10:18:44"
"21441","0","156","6","le meilleur c'est bien kev ! adorable ?","0","1",NULL,"2013-04-27 16:23:29"
"21460","0","156","6","Kev' tu es parfaitement parfait a 100% !I love kev' adams ;)","0","1",NULL,"2013-04-29 18:50:56"
"21461","0","155","6","Kev' le meilleur de tous et en plus il est pas so cuute ! ;) Loove you kev","0","1",NULL,"2013-04-29 18:54:50"
"21491","0","155","6","Kevin smadja c'est le meilleur de tous ","0","1",NULL,"2013-05-09 16:40:11"
"21494","0","436","6","superbe chanson! Comment s'appelle le comedien qui est dans le clip hunder?","0","1",NULL,"2013-05-09 23:55:52"
"21534","0","255","6","Tal tu chante trop bien jtm j'aimerait trop te rencontrer","0","1",NULL,"2013-05-12 16:14:01"
