"id_com","id_membre","id_contenu","id_type","commentaire","abonner_fil","statut","pseudo_v1","date_post"
"19548","0","2049","2","I guess that to get the <a href=\"http://goodfinance-blog.com/topics/personal-loans\">personal loans</a> from banks you should have a great reason. Nevertheless, once I've got a bank loan, just because I was willing to buy a car. ","0","0",NULL,"2012-03-20 16:17:55"
"19556","3277","2812","2","essaye de lui parler de plus en plus (en commencant par des trucs simples comme \"hey pour la sortie de classe tu sais venir?\" et continuer la discussion naturellement. apres, quand la glace est \"brisée\", demande lui des trucs plus personnel comme\" tu fais quoi pendant les vacances? tu fais quoi comme activité extrascolaire?\" en essayant de caser des petites remarques droles par-ci, par-la. bref commence comme ça et après le reste viendra tout seul :)","0","1",NULL,"2012-03-21 13:22:10"
"19554","0","619","2","pour les fille intéresser a entamé une carrière de mannequins ..qu'elle me contactent surr teffahi.ayoub@gmail.com","1","1",NULL,"2012-03-21 03:32:08"
"19558","0","279","2","Salut j'aime un garcon mais c un gros con","0","1",NULL,"2012-03-21 15:48:22"
"19559","0","1552","2","Salut,j'ai 13 ans et j'ais ce fameux duvet au dessus de la lèvre supérieur cela me complexe énormément surtout que les gens le fixe quand ils me parlent c'est très gênant!!! en plus je rougis très vite !!! alors voila sachant que j'ais la peau foncé et beaucoup de poils,aidez moi a ne plus être une tomate poilue!!!! merci d'avance                                                                            Anna","0","1",NULL,"2012-03-21 21:40:32"
"19565","0","218","2","Make your own life easier take the <a href=\"http://goodfinance-blog.com/topics/personal-loans\">personal loans</a> and all you require. ","0","0",NULL,"2012-03-22 06:15:06"
"19566","0","746","2","Je suis dans le même problème que vous.moi ont na fait 13ans ensemble il a été amené a l'intérieur du pays pour son boulot. ce de laba que je appris kil va se marié comme je m'attendé pas a ca je trop souffert je fait un moi que je mange pas je dort pas je fallu me tué.il et revenu vers moi je le pardonné comme je l'aime et lui ne pas heureux dans son mariage actuellement ca fait 2 ans kil et marié et ils n'ont pas d'enfants. mais a l'heure ou je vous parle je suis decouragé de lui par certains actes kil me fait encore.   ","0","1",NULL,"2012-03-22 14:10:53"
"19567","0","746","2","Titi sala","0","1",NULL,"2012-03-22 14:12:42"
"19568","0","1926","2","moi c pareil  et quand  je regarde mes copines qui  en ont   et ba  moi  je me dit que j en voudrais mes  je  peut pas   m  en  empecher","0","1",NULL,"2012-03-22 18:33:44"
"19571","3277","2897","2","ok merci beaucoup je vais essayer \"agir\" :D ce site est vraiment super!","1","1",NULL,"2012-03-22 19:49:22"
"19578","0","404","2","Je vouler savoir j'ai Fai un tatouage sur le cou et je regrette Vrement ","0","1",NULL,"2012-03-23 07:59:39"
"19582","0","608","2","moi jpa eu dè raport mais j trop peur dè pas avoir du sang  sur mon dra car mes copines mont di qu'on seigné pas enfin pas ttes les filles :S ","0","1",NULL,"2012-03-25 00:12:36"
"19584","0","1270","2","bonjour .. j'ai enlever mon implan sa fait deja 5mois... et g jamais eu a avoir mal au tetons. depuis une semaine mes tetons me font tres mal. mercide me rensegner un peu plus car g peur maintenan d'aller chez mon medecin.","0","1",NULL,"2012-03-25 20:36:44"
"19595","3291","473","2","Bonjour, je suis Ludmila et j'ai 12 ans ; j'ai les cheveux très sec, frisés et se gonflent. On m'a déconseillé le défirisage  parce que je n'ai pas encore mes règles. Quoi faire? donnez moi des astuces ou un bon traitement pour qu'ils soient lisses, brillants et souples. Merci    ","1","1",NULL,"2012-03-27 20:08:53"
"19588","0","404","2","Bonjour je vouler savoir pour enlever un tatouage sur cou  comment fair si vous plaît je regrette Vrement je c Ap si maintenant jvai trouver du boulot ","0","1",NULL,"2012-03-26 08:25:02"
"19591","0","642","2","vous lui conseillez de se mastureber c'est mal et c'est un peche","0","1",NULL,"2012-03-26 13:24:33"
"19596","0","1456","2","salut,j'ai coloré mes cheuveux le 03/02/2012 avec un blond foncé cendré profond 6.11 nutrice puis j'ai fait une aitre coloration le 22/03/2012 avec un maron glacé  casting l'oréal crème gloss,et j'ai eu un maron neigre presque noir maintenant je veux éclaircir mes cheuveux que dois-je faire?","1","1",NULL,"2012-03-27 20:38:46"
"19600","0","2534","2","Salut je suis Nicolas j'ai 13 ans et je suis en 3ème j'ai un peu le même problème que toi j'ai eu des problème en 4ème et en 3ème plus rien ne va j'ai du rater près de 1 mois et demis a cause de ce problème voila : tout les matin je vomis avant d'aller a l'école car j'ai peur de la journée qui va arrivée peur d'avoir des mauvaise notes des mauvaise remarques ... Et j'en est parlé a ma Prof principales, on a chercher des solution et maintenant ca va mieux les matin je me dit que tout va bien se passer et que sa va passer tout seul. Mais je croit que sa a gâcher mon orientation. Et maintenant sa m’embêtes pour rester polis .         ","0","1",NULL,"2012-03-28 20:41:10"
"19603","0","747","2","ASTUCE POUR CE MAQUILLE ASSEZ BIEN MAIS SURTOU RAPIDEMENT ;je n es jamais le temps le matin","0","1",NULL,"2012-03-30 09:42:27"
"19607","3306","2858","2","Tu es vraiment pas la seule fille qui fait sa ;) Crois moi ! :) !","0","1",NULL,"2012-03-30 22:32:26"
"19609","0","1613","2","je voudrai perdre 28 kilo pouvais vous maider","0","1",NULL,"2012-04-01 15:27:05"
"19612","0","473","2","moi je vous conseil lhuile d'olive avec le gironfle on poudre c vrément eficace pour fair poussé les cheveux il fo le léssé toute la nuit ds une serviette","0","1",NULL,"2012-04-01 20:35:19"
"19626","3311","2605","2","coucou , et bien il y a le livre éternel il contient plusieurs tome , il répond a peu prés a tout tes critères et je trouve qu'il est magnifique","0","1",NULL,"2012-04-03 19:45:36"
"19625","0","2897","2","Moi, il y a un mec que j'aime a mourir, je lui ait dit que je l'aimais et il m'a rembarrer alors qu'on etait amis.Aors je sais plus ou j'en suis et ses conseil ne serve pas a grand chose...... Apres tu fais ce que tu veux c'est ta vie.","0","1",NULL,"2012-04-03 13:29:26"
"19630","3310","2907","2","Personnellement, j'ai eu de l'acné durant les premières années de mon adolescence, et j'ai quelques techniques pour ce qui est d'atténuer au maximum les cicatrices:1) Le jus de citron: Après m'être douchée, j'appliquais quelques gouttes de citron sur les cicatrices de mon visage, je laissais agir une dizaine de minutes, ensuite je rinçais le tout à l'eau claire, et appliquais une crème hydratante/!\\ pour les peaux sèches et/ou sensibles, il ne faut pas répéter cela plus d'une fois par semaine et même utiliser un savon à ph neutre pour rincer le visage, afin de contraster avec l'acidité du jus de citron, pour tout autre type de peau, le maximum est de deux fois par semaine.Effet du jus de citron: il éclaircit les cicatrices, et certaines disparaissent au fil du temps2) L'argile verte: L'argile verte à le même effet que le jus de citron, de plus, elle est moins acide. Le temps idéal pour laisser agir l'argile verte est généralement indiqué sur le tube ou l'emballage, il y a même un temps différent pour chaque type de peau!/!\\Tout comme le citron, 1 fois par semaine pour les peaux sensibles et/ou sèches plus autres conseils(voir jus de citron); et 2 fois par semaines maximum pour tout autre type de peauVoilà, deux petites techniques pas trop chers que l'on peut faire au quotidien, en espérant vous avoir rendu service!","1","1",NULL,"2012-04-04 12:37:38"
"19633","0","619","2","Je vais vous parler d'une petite chose ... Moi-même, qui fait une petite taille, 1m65 pour 13 ans, je mets des talons :) Pas si hauts, mais des beaux talons quand même (6cm), car à cause des gens de ma famille qui sont tous grands, je parais minuscule !! Et ma mère, qui fait 1m80, met jusqu'à 10cm de talon et l'assume :)","0","1",NULL,"2012-04-04 17:05:18"
"19635","0","866","2","J'ai 13 ans et dans ma famille on a une morphologie tres speciale car ln mange beaucoup et on ne grossit pas du tout je fait 37 kg pour 1'60 m .je suis au college et en plus en 4eme les moqueries font un ravage dans ma tete j'en ai marre s'il vous plait donner moi des conseil .","0","1",NULL,"2012-04-04 18:42:55"
"19653","0","2915","2","merci margaux","0","1",NULL,"2012-04-06 15:54:50"
"19654","0","1545","2","Bonne chance troliloll","0","1",NULL,"2012-04-06 18:57:34"
"19655","0","1545","2","Moi c'est pas pareil, je suis parfaite avec un nez super beau aha XD Dans ton cul","0","1",NULL,"2012-04-06 18:58:38"
"19645","0","1473","2","merci MGP, j'ai trouvé des mocassins marque dingo pour mon mari, introuvables sauf en ligne.merci encorelison75015","0","1",NULL,"2012-04-05 13:26:52"
"19656","0","338","2","moi je suis sortie avec un gars pendant 8mois, un mois a peu pres après il est sorti avec un autre et quelques mois apres nous nous sommes revu et depuis c'est le cauchemard !! on se voi on se quitte on se revoit on ne peu jamais se séparer on se voit tout les jours !! il tient a moi c'est sur mai aime sa copine ! je ne sais plus ou j'en suis je l'aime tellement c'est tellement fort que je ne peux faire autrement que de l'attendre alors qu'il ma di plusieurs fois qui ne voulais pas me faire de mal et ne pas me voir attendre j'ai peur de la suite... et j'ai bousiller mon année a cause de sa .. sa fait un an et demi que sa dure que je le voit avec une autre ... aider moi ! ","0","1",NULL,"2012-04-06 19:34:18"
"19670","3324","2907","2","Salut met toi tous les soirs de l'huile d'Argan sur ton visage ca enleve les boutons et ça va cicatrisé sans laisser de marque,tu peux mettre aussi du dentifrice sur tes boutons ça va aider à leur élimination ,les produits naturelles sont des produits miracle arrêter les produits chimique les filles bisou","1","1",NULL,"2012-04-09 01:58:12"
"19669","0","725","2","alexandre (08-04-2012 a 21h20) bonsoire j ai 32 an je pese 73 kg pour 1m79 je fait du sport tout les jours, j ai une bonne carrure , mais je suis trop mince au niveau des fesses,comment faire pour les fairent grossir,,","0","1",NULL,"2012-04-08 21:23:24"
"19672","3324","1668","2","L'huile de ricin les filles rien de tel pour les faire pousser,appliquer la sûr les racines en massant bien puis les longueurs mettez une serviette et laisser poser toute la nuit a faire tous les 2jours pour un résultat rapide .petit conseil mélanger l'huile de ricin (huile epaisse)à de l'huile d'olive beaucoup plus fluide et en plus ça les nourrit et les rend beaux ","1","1",NULL,"2012-04-09 02:45:30"
"19673","0","2486","2","Huile de ricin ,huile d'olive et œufs super pour hydrater les cheveux tu peux ajouter du miel ,lhuile dargan aussi est super mais assez cher laisse poser une heure avant ton shampoing ou toute la nuit  ","1","1",NULL,"2012-04-09 03:11:14"
"19682","0","811","2","cher branda cest que ton mec ne taime pas dsl","0","1",NULL,"2012-04-10 16:23:00"
"19686","0","1979","2","People deserve good life and <a href=\"http://goodfinance-blog.com/topics/credit-loans\">credit loans</a> or auto loan will make it better. Just because people's freedom depends on money. ","0","0",NULL,"2012-04-12 07:47:52"
"19688","0","2852","2","cc isys le probleme vien de ton copin .di luit de voire un toubibe","0","1",NULL,"2012-04-12 17:53:28"
"19690","0","2493","2","Moi je pense que 2 personnes qui t'aiment c'est tres bien !!??J'ai le meme age que toi et personne ne pense ou m'a dit qu'il m'aimait ..Pense à toutes ces filles qui sont rejetées de tous juste parcequ'elles sont timides ou autre ..Ces filles là en plus de ne pas avoir d'amoureux n'ont aucun(e)s ami(e)s !!Et elles vivent un calvaire surement à cause de gens comme toi qui se plaignent parce que soidiant elles n'ont pas d'amoureux ,alors que votre faux couple va durer maxi 3 jours !!!!","0","1",NULL,"2012-04-13 17:08:38"
"19695","0","1906","2","salut,moi aussi j'ai mer perte blanche et je voudrais savoit si mes regle approche","0","1",NULL,"2012-04-14 01:37:20"
"19696","0","400","2","Salut les filles !! ça fait 19 mois depuis que jai accouché, jais allaité pendant 8 mois , et pendant ma grossesse je pésais 48kg et apres mon accouchement jais pris 10kg et je pèse 58kg ,mais depuis mon accouchement jai tjrs un gros ventre comme si je suis tjrs enceinte de 6 mois ,que faire pourque mon ventre redevient normal cad plat aidez moi svp merci et a bientot !","1","1",NULL,"2012-04-15 13:21:40"
"19697","0","1183","2","oui mais si ont veux avoir une coupe plus longue avec ces cheveux esce possible?","0","1",NULL,"2012-04-15 16:46:17"
"19698","0","2931","2","Bonjour,j'ai 13 ans.Les garçon ne me regarde pas parce que je suis ronde(moi je me trouve jolie mais on me dit tout le temps que je suis grosse alor je me sans mal dans ma peau.)J'ai 1 seul amie sinon les autre c'est pour que je soi a leurs service.J'aimerai me sentir aimé et que un garçon me regarde.J'aimerai aussi changer mon look.  ","1","1",NULL,"2012-04-15 19:31:42"
"19699","0","889","2","Moi 11 j'ai bientot 12 ans ma mere ne veut pas que je porte de talon de 4,5 mais ce ne sont pas des talon aiguile.Sa m'énerve!!!!","0","1",NULL,"2012-04-15 20:05:34"
"19705","0","796","2","J'aime pas mes épaules et mon nez...surtout quand j'ai appris que ma mère c'était fait refaire le siens.. ","0","1",NULL,"2012-04-16 11:08:05"
"19701","0","889","2","On a pas de chance les filles!!","0","1",NULL,"2012-04-15 20:11:30"
"19702","0","2552","2","olala ma pauvre j’espère que tu va résoudre ce problème.","0","1",NULL,"2012-04-15 20:17:57"
"19707","0","541","2","j ai connu sa moi il lui a parler avec une certaine fille sur messenger il ma dit que c etait une amie d enfance retrouver sur internet et qu elle avait un mec en plus j avais eu un accident de scoot j avait etait platré un week end il m avait dit qui allait voir des potes c etait un mensonge il ma trompé avec cette fille qui savée qu il  etait en couple il est rentrée un dimanche soir me dire que c etait fini et qu il avait des progés avec cette piqueuse de mecs comme quoi ce genre de mecs ton trompé une fois et peuvent recommencé elodie38","0","1",NULL,"2012-04-17 08:43:02"
"19709","0","2897","2","je suis totalement d'accord que si tu n'essaie pas si tu n'agi pas alors tu le regretra vraiment et encore plus si tu est vraiment amoureuse de lui !!! ","1","1",NULL,"2012-04-18 15:53:56"
"19710","0","2858","2","tout le monde crois que pour les mecs ca parait normal mais que pour les filles ca ne l'ai pas mais en effet si les mecs le font pourquoi pas les filles","1","1",NULL,"2012-04-18 16:02:22"
"19712","0","2601","2","moi aussi j'aime bien ce style.","0","1",NULL,"2012-04-18 18:56:24"
"19713","0","2493","2","moi j'ai pas d'amoureux.","0","1",NULL,"2012-04-18 19:30:15"
"19714","0","2405","2","je fait la même taille que toi et le même poids,je mange aussi même quand je n'ai pas faim. ","0","1",NULL,"2012-04-18 20:00:09"
"19715","0","473","2","moi j'aimerai bien que vous me donniez un bon masque pour nourrir mes cheveux qui sont tres secs et colores","0","1",NULL,"2012-04-18 23:05:55"
"19716","0","2539","2","j'ai 12 ans et c'est exactement la meme chose avec moi mais c'est plus le contraire ! :(","0","1",NULL,"2012-04-19 10:24:26"
"19717","0","575","2","Bonjour. Je ressent depuis quelques jours des maux de ventre maux de tête. J'ai constamment envi de vomir. Toutes les odeurs mecoeur. Je ne mange presque plus. J'ai de forte pertes blanches. Puis je être enceinte?  Merci d'avance pour vos réponses.  ","1","1",NULL,"2012-04-19 14:43:18"
"19727","0","1220","2","bonjour, aussi atteinte du vitiligo jaimerai faire un tatouage au pied ( je n'ai pas de vitilo à cet endroit)finalement avez vous fait le votre? j'ai peur de recevoir de nouvelle tâche à cet endroitmerci d'avance","0","1",NULL,"2012-04-20 12:26:43"
"19730","0","847","2","PORN IL REGARDE CA ! ca me tu . ","0","1",NULL,"2012-04-20 15:01:31"
"19731","0","847","2","COMMENT LE FAIRE ARRéTER DE REGARDER CA !je vais le ...","0","1",NULL,"2012-04-20 15:03:32"
"19734","0","1716","2","N'importe quoi, toutes les filles n'ont pas de cellulites et je veux bien me raser la tête si tu en trouves chez moi d'ailleurs !!","0","1",NULL,"2012-04-20 21:05:49"
"19736","0","771","2","salut moi je dis il faut discuter avec ton mari et qu il choisi entre toi et elle et tu stop","0","1",NULL,"2012-04-21 01:32:59"
"19737","0","2057","2","Je ne comprend pas que les compagnes actuelles se mêlent du conflit préexistant avec nos ex. Mon histoire est fini et j'ai été menacée violemment par la compagne du père de mes enfants du coup j'ai rompu toute communication c'est tant pis maintenant mais je prend de la distance et j'ai constaté que cette femme était animée par la rage alors que je ne l'ai jamais vu ni même rencontrée ... Après reste à savoir ce qu'il lui a dit sur mon compte.","0","1",NULL,"2012-04-21 02:33:37"
"19739","0","1322","2","Coucou. Je suis comme toi , j'ai des taches de rousseur un tout petit peu mais qui se voit pas totalement beaucoup mais j'ai aussi 3 ou 4 grains de beauté ( tout cela me vas bien ) . On dit que c'est moche mais enfaite c'est beau. Mais moi que 1 chose ne vas pas , je ne trouve pas la bonne coupe de cheveux pour que je suis vraiment belle. Bref' j'ai un petit copain mais voilà quoi , je veux aussi me faire plaire. Bref'! Je pense que tu dois être jolie , les taches de rousseur ne sont pas moche :) .","1","1",NULL,"2012-04-21 17:09:29"
"19743","0","798","2","j ai le visage ovale quel coupe de cheveux me fait","0","1",NULL,"2012-04-23 16:24:34"
"19748","0","1542","2","BONJOUR JE SUIS RONDE DE PARTOUT JE C PLUS COMMENT FAIRE JéTAIS TRéS MINCE PUIS D'UN COUP RONDE PARTOUT DONC MAINTENANT JE SUIS TRES COMPLéxé car tout le mond s'etonne de ma prise de pois il \"me questionne pourquoi ta grossi\"?? ect bref aide moi a etre bien a m'habiller bien pour me sentir belle car \"JE ME TROUVE LAIDE \"CAR JSUIS RONDES ET JE C PAS ETRE BIEN DANS MA PEAU...","0","1",NULL,"2012-04-25 20:55:23"
"19749","0","2951","2","bonjour j,ai 28 ans 2enfants d,un premier divorce mon ex mari m,aimais et sa jen ,naie aucun doute mes il etais violent a la moindre dispute cetais des baffes des insultes point de vue financier cetais le chaos je me suis séparer de lui il ma courru dérriere mes ma déscision étais prise;je l,aie oublier tres facillement jai eu d,otre relation ou la je me santais bien mes pas d,amour juste de l;attirence la plaissance besoin d,affection et d,un homme,puis la sa fais 1ans que jai rencontrer cette homme la je suis directe tomber love il et grand de taille 1m92 et moi 1m54 mes il est speciale on sort pas jamais en 1ans 2sortie 1au resto 1au snack jai eu des cadeau bague en or chaine jolie montre 1beau manteau 1sac de marque 1tv plasma 1pc portable il me fais les courses 2ou3fois par mois il me donne un peu cache mes bon pas de compliciter des fou rire se balader rien la il ma demander en mariage il a apellé mon pere qui vis ds un otre pays donk plus simple il lui a tel mon mes je me sent délaissé on se voit que a la maison qd je luis il me repond se naie pas sa le plus important de sortire sa sa viendra apres donk je me ronge triste mal de vie qd je me plain il me dis ma cherie je te donne mes yeux je sais je pense pas qui maime des moment oui des moment non jai pas envie dun 2ieme échek no mon ex lui et dja marier mo mec lui et tous le contraire de mon ex froid il senerve jamais et sa me tue conseiller moi merci car plusieure cerveau qui pense c mieu qun.ET AU LIT BEN IL A UN BON CALIBRE MES IL LACHE VITE ET IL CHERCHE QUE SON PLAISIRE QD JE DIS JE VEUX ENCORE IL ME DIS C TOUS CHUI FATIGUER ET PUIS IL ME PREND DS SES BRAS ET IL DORTS COMME UN BEBE ET MOI JME BOUFFE DE LINTERIEURE SES MOI QUI ET FOLLE OU CHEZ PAS ","0","1",NULL,"2012-04-26 13:34:26"
"19746","0","561","2","bonjour moi j mapelle anonyme j ai 14 ans j ai un gros nez avec plein de shtars et zerma j voudrai savoir kell coupe fair j ai des long j cheveu j me makill pa","0","1",NULL,"2012-04-24 22:43:58"
"19757","0","553","2","Est ce que cette crème est-elle toujours en vente et si oui a quel magasin s'il vous plait ?","0","1",NULL,"2012-04-27 23:04:58"
"19758","0","1669","2","je suis désolée mais je ne penses pas que t'es une chance, il ne parraît pas le genre de mec qui te conviendrais miss","0","1",NULL,"2012-04-27 23:26:10"
"19765","0","575","2","Bonjour,voila il y a deux semaine j'ai eu un rapport non protéger il c'est arrêter kan il a su ke sa venai et on a recomencer et du coup on re arrêter,depuis kelke temps j'ai des bouffer de chaleur j'ai un retard on va dire depuis que je l'ai fait,j'ai l'impression davoir Mal sur ke coter de la poitrine comme si il y aval des boum j'ai tout le temps ou defois non j'ai l'impression davoir envie de vomir et Mon ventre glonfle, j'ai l'impression ke mon corp a changer alors je ne sais pas si c'est le stress ou si c'est le simtome sa ma Ric une fois tout les 3jour on va dire ke je prenne Mal a la tête mais sa dure 1min,je change de caractère et je pleur très facilement kan on me fait une remarque... J'ai peur de faire un test car jai envie de letre mais d'un autre coter jai peur de la réaction de mais parent. Mercie de mavoir écouter est ce que kalkun peut me renseigner maigres ke jai regarder d'autre commentaire??!","1","1",NULL,"2012-04-30 23:59:41"
"19751","0","725","2","bonjour je fait 1m53 pour 38kg je mange toute la journer enormément de fromage beaucoups de viande la plus par du temps je prend des barquette de 1kg et je ne grossi pas jen n'est vrement marre comment faire pour grossir aider moi svp merci","0","1",NULL,"2012-04-26 16:54:46"
"19771","0","279","2","Salut, j'ai 15 et depuis le mois de février j'aime mon meilleur ami, on se connait depuis la maternelle et nous sommes meilleur ami depuis le CM2. Le problème c'est qu'il est très immature, foufou et peu sérieux. Je l'aime à fond mais je ne pense pas qu'il partage ses sentiments avec moi... tous le monde me dit qu'il m'aime mais je ne crois que ce que je vois ou j'entends (et oui xD) et j'ai pas très envie de me prendre un rateau ^^' ! Mais il n'y a pas qu'un seul problème... mais trois ! Premièrement, ma meilleure amie est rède dingue de lui depuis 3 ans et je suis la première sur qui elle compte pour savoir si il partage ses sentiments... deuxièmement, il est immature, donc les sentiments pour lui c'est le dernier de ses soucis ! Et troisièmement, j'ai peur que tout change s'il apprend que je l'aime... parce qu'on se fait des calins et j'ai peur qu'il s'éloigne de moi pour ne pas me faire de faux espoirs... et en plus du destin on est né le même jour xD 19 juin lui à 12h moi à 9h du matin mdrHELP ME !Cette relation est entre l'amitié, la trahison, le désespoir et la perte ! ","1","1",NULL,"2012-05-01 23:42:49"
"19753","109","2956","2","top ces conseils","0","1",NULL,"2012-04-26 18:10:58"
"19772","0","410","2","salut , je suis d'origine africaine camerounaise ,j'utilisais des produits eclaircisant s mais j'ai arreté depuis 3 ans je souffre d'une hyper pigmentation  comme des taches noires au dos, aux cuisses, j'ai appliqué des cremes eclaircissantes rien, et ca reste là et je ne peux pas porter de minijupe ni de dos nu , ma silhouette nest pas affirmé je porte tjrs des jeans , je voudrais etre manekin et je ne peux pas le faire avec ces defauts, je vous en prie aidez moi","0","1",NULL,"2012-05-02 13:36:25"
"19775","0","730","2","salut moi en ce moment meme je sort avec mon cousin germzins et tout ce passe bien sauf que on se voi pas souvent pck on a 6 décart et c dur de ce voir mais on essais on attend juste que je soi majeur pour l'annoncé a mes parent .. et j'ai peur quil le prenne mal .. deja que nous avon l'impression quil y a des doute mais on s'aime tellement on sais plus quoi faire pck on aimerait bien le dire mais le pb c qu'on a peur quil le prenne mal et qui ne veulent plus qu'on se voye et qui nous sépare ..","0","1",NULL,"2012-05-02 20:18:27"
"19776","0","783","2","j'ai essayer moi aussi avec mon copain c'était notre 1er fois a tout les deux lui a adorer moi pas trop c vrai que j'ai eu mal mais je pense que c'est parce que j'ai pas habitude et que peux etre part la suite sa sera meillure. J'ai la chance avoir un partenaire tres a ecoute et tendre. Meme si pour moi sa a pas etait top je suis tres contente avoir partager cette nouvelle experience avec lui ","0","1",NULL,"2012-05-02 21:09:17"
"19777","0","2379","2","bonjours j'ai 13ans et un garcon me plait mais lui il préfère les files populaires comment faire pour qu'il m'aprécit meme si c'est juste pour etre ami??","0","1",NULL,"2012-05-02 22:32:26"
"19778","0","575","2","bonjour, je prend la pillule minidrill depui 3 an et deux semaine avan mon cicle de regle jai oublier ma pillule pdt 3jour daffiler et jai eu un rapport non proteger , jai repri ma pillule le lendemin soir depuii jai tous le temps mal a la tete jai eu mes regle 3 jr presque rien !!! jai mal au ventre et svt envi de vomir quand je suis allonger et depui kelke jour je fai svt pipi deu foi plu des ke jboi !!!! esr ce que vous penser que je peu etre enceinte ?? repondez moi svppppp","1","1",NULL,"2012-05-03 03:54:03"
"19781","0","1037","2","Si le henné peut empêcher de faire des colorations à oxydation, eh bien c'est tant mieux, car ces dernières sont hautement toxiques. Sinon, il existe plein de teintures aux plantes, et avec le henné et le henné neutre (non colorant, en fait du cassia), l'indigo, la garance, le curcuma, etc., on peut varier pas mal les nuances, en toute sécurité.","0","1",NULL,"2012-05-03 17:49:11"
